{
  "$schema": "http://json-schema.org/draft-07/schema#",
  "title": "AgentPlane EvaluatorSgrResult",
  "description": "Read-only EVALUATOR output. AgentPlane validates frozen evidence and owns all persistence.",
  "type": "object",
  "additionalProperties": false,
  "properties": {
    "schema_version": {
      "type": "integer",
      "enum": [
        1
      ]
    },
    "kind": {
      "type": "string",
      "enum": [
        "evaluator_result"
      ]
    },
    "evaluator_id": {
      "type": "string",
      "minLength": 1
    },
    "verdict": {
      "type": "string",
      "enum": [
        "pass",
        "rework",
        "blocked",
        "human_review"
      ]
    },
    "findings": {
      "type": "array",
      "items": {
        "type": "object",
        "additionalProperties": false,
        "properties": {
          "id": {
            "type": "string",
            "minLength": 1
          },
          "severity": {
            "type": "string",
            "enum": [
              "low",
              "medium",
              "high"
            ]
          },
          "summary": {
            "type": "string",
            "minLength": 1
          },
          "broken_invariant": {
            "type": "string",
            "minLength": 1
          },
          "evidence_refs": {
            "type": "array",
            "minItems": 1,
            "items": {
              "type": "object",
              "additionalProperties": false,
              "properties": {
                "path": {
                  "type": "string",
                  "minLength": 1
                },
                "sha256": {
                  "type": "string",
                  "pattern": "^sha256:[a-f0-9]{64}$"
                },
                "line": {
                  "type": "integer",
                  "minimum": 1
                },
                "lines": {
                  "type": "string",
                  "minLength": 1
                },
                "section": {
                  "type": "string",
                  "minLength": 1
                }
              },
              "required": [
                "path"
              ]
            }
          }
        },
        "required": [
          "id",
          "severity",
          "summary",
          "broken_invariant",
          "evidence_refs"
        ]
      }
    },
    "missing_tests": {
      "type": "array",
      "items": {
        "type": "string"
      }
    },
    "hidden_assumptions": {
      "type": "array",
      "items": {
        "type": "string"
      }
    },
    "recovery_context": {
      "type": "string",
      "minLength": 1
    }
  },
  "required": [
    "schema_version",
    "kind",
    "evaluator_id",
    "verdict",
    "findings",
    "missing_tests",
    "hidden_assumptions"
  ]
}
