{
  "schema_version": 1,
  "kind": "evaluator_result",
  "evaluator_id": "recovery-context",
  "verdict": "pass",
  "findings": [
    {
      "id": "compatibility-finding-1",
      "severity": "medium",
      "summary": "The implementation diff remains unchanged: deterministic source-set locking, durable receipts, and fail-closed unknown task creation preserve the CLI-versus-agent boundary.",
      "broken_invariant": "Compatibility evaluator facade requires independent review evidence.",
      "evidence_refs": [
        {
          "path": ".agentplane/tasks/202607221850-WM9X1G/quality/20260728-081705829-recovery-context/evaluator-diff.patch"
        }
      ]
    }
  ],
  "missing_tests": [],
  "hidden_assumptions": []
}
