{
  "schema_version": 1,
  "kind": "evaluator_result",
  "evaluator_id": "recovery-context",
  "verdict": "pass",
  "findings": [
    {
      "id": "compatibility-finding-1",
      "severity": "medium",
      "summary": "Repository-aware quick init now selects branch_pr when GitHub Actions is detected, retains direct for a fresh repository, and explains both decisions in the preview.",
      "broken_invariant": "Compatibility evaluator facade requires independent review evidence.",
      "evidence_refs": [
        {
          "path": ".agentplane/tasks/202608061742-G2ZA4T/quality/objects/sha256/161593483b94843e3ff41ac27f62673e7bd91b3a2c11d3c03aa4818ab6e47749.patch"
        }
      ]
    },
    {
      "id": "compatibility-finding-2",
      "severity": "medium",
      "summary": "Quick and advanced paths are separated, explicit flags stay non-interactive, and the post-init next step uses the user-first task create entrypoint.",
      "broken_invariant": "Compatibility evaluator facade requires independent review evidence.",
      "evidence_refs": [
        {
          "path": ".agentplane/tasks/202608061742-G2ZA4T/quality/objects/sha256/161593483b94843e3ff41ac27f62673e7bd91b3a2c11d3c03aa4818ab6e47749.patch"
        }
      ]
    }
  ],
  "missing_tests": [],
  "hidden_assumptions": []
}
