{
  "schema_version": 1,
  "kind": "evaluator_result",
  "evaluator_id": "recovery-context",
  "verdict": "pass",
  "findings": [
    {
      "id": "external-agent-finding-1",
      "severity": "medium",
      "summary": "The help snapshot now matches the existing public route enum/default, and explicit positive and negative assertions keep the removed repository default from returning unnoticed.",
      "broken_invariant": "External EVALUATOR review requires evidence-backed semantic judgement.",
      "evidence_refs": [
        {
          "path": ".agentplane/tasks/202608271251-GHHA0Q/quality/objects/sha256/87363b64dfbbc8acb0a0e1d49c8a00c932eb1f73b80583339c6e83f8490049d8.patch"
        }
      ]
    },
    {
      "id": "external-agent-finding-2",
      "severity": "medium",
      "summary": "The worktree fixtures now obtain an actual structured PLANNER proposal and assert explicit fixture approval before requiring EXECUTOR scoped-write packets. They do not relabel a planner packet as execution to make the test pass.",
      "broken_invariant": "External EVALUATOR review requires evidence-backed semantic judgement.",
      "evidence_refs": [
        {
          "path": ".agentplane/tasks/202608271251-GHHA0Q/quality/objects/sha256/87363b64dfbbc8acb0a0e1d49c8a00c932eb1f73b80583339c6e83f8490049d8.patch"
        }
      ]
    },
    {
      "id": "external-agent-finding-3",
      "severity": "medium",
      "summary": "Replacing an internal transition hash formula and a fixed preliminary operation count preserves the meaningful constraints: packet/exchange identity, task and role, purpose, exact checkout, frozen HEAD, one pending journal intent bound to the work order and fingerprint, prior completed operations, unique operation keys and no-mutation observation/recovery paths.",
      "broken_invariant": "External EVALUATOR review requires evidence-backed semantic judgement.",
      "evidence_refs": [
        {
          "path": ".agentplane/tasks/202608271251-GHHA0Q/quality/objects/sha256/87363b64dfbbc8acb0a0e1d49c8a00c932eb1f73b80583339c6e83f8490049d8.patch"
        }
      ]
    },
    {
      "id": "external-agent-finding-4",
      "severity": "medium",
      "summary": "The recovery fixture's deterministic ci:local:full script checks the intended payload in its temporary repository. It does not modify project CI; recipe runtime artifacts are excluded consistently with the other injected harness runtime artifacts.",
      "broken_invariant": "External EVALUATOR review requires evidence-backed semantic judgement.",
      "evidence_refs": [
        {
          "path": ".agentplane/tasks/202608271251-GHHA0Q/quality/objects/sha256/87363b64dfbbc8acb0a0e1d49c8a00c932eb1f73b80583339c6e83f8490049d8.patch"
        }
      ]
    },
    {
      "id": "external-agent-finding-5",
      "severity": "medium",
      "summary": "Prompt beforeEach hooks establish deterministic input mode; afterEach retains environment restoration. Existing explicit plain-mode, interactive TTY, cancellation and cached-loader assertions are unchanged. Both inherited-environment variants pass.",
      "broken_invariant": "External EVALUATOR review requires evidence-backed semantic judgement.",
      "evidence_refs": [
        {
          "path": ".agentplane/tasks/202608271251-GHHA0Q/quality/objects/sha256/87363b64dfbbc8acb0a0e1d49c8a00c932eb1f73b80583339c6e83f8490049d8.patch"
        }
      ]
    },
    {
      "id": "external-agent-finding-6",
      "severity": "medium",
      "summary": "Frozen verification records bind the passing scoped tests and full ci:local:full to implementation SHA 54ed013b9e52173795ee80b5acdb7b47913b8b4b. Production source, policy, workflows, release files and roadmap dependencies are absent from the frozen implementation diff.",
      "broken_invariant": "External EVALUATOR review requires evidence-backed semantic judgement.",
      "evidence_refs": [
        {
          "path": ".agentplane/tasks/202608271251-GHHA0Q/quality/objects/sha256/87363b64dfbbc8acb0a0e1d49c8a00c932eb1f73b80583339c6e83f8490049d8.patch"
        }
      ]
    },
    {
      "id": "external-agent-finding-7",
      "severity": "medium",
      "summary": "Residual risk: Two local structured-plan fixture builders duplicate schema setup; future shared testkit modernization should consolidate them within its own approved scope.",
      "broken_invariant": "External EVALUATOR review requires evidence-backed semantic judgement.",
      "evidence_refs": [
        {
          "path": ".agentplane/tasks/202608271251-GHHA0Q/quality/objects/sha256/87363b64dfbbc8acb0a0e1d49c8a00c932eb1f73b80583339c6e83f8490049d8.patch"
        }
      ]
    },
    {
      "id": "external-agent-finding-8",
      "severity": "medium",
      "summary": "Residual risk: The old broad failure inventory must be rerun before claiming a remaining failure count or 0.7.8 readiness.",
      "broken_invariant": "External EVALUATOR review requires evidence-backed semantic judgement.",
      "evidence_refs": [
        {
          "path": ".agentplane/tasks/202608271251-GHHA0Q/quality/objects/sha256/87363b64dfbbc8acb0a0e1d49c8a00c932eb1f73b80583339c6e83f8490049d8.patch"
        }
      ]
    }
  ],
  "missing_tests": [],
  "hidden_assumptions": []
}
