{
  "schema_version": 1,
  "kind": "evaluator_result",
  "evaluator_id": "recovery-context",
  "verdict": "pass",
  "findings": [
    {
      "id": "compatibility-finding-1",
      "severity": "medium",
      "summary": "Implementation commit 1c7849f0e remains the semantic change and satisfies the route contract.",
      "broken_invariant": "Compatibility evaluator facade requires independent review evidence.",
      "evidence_refs": [
        {
          "path": ".agentplane/tasks/202608061646-WCARQG/quality/objects/sha256/87f84112d774433f055ea519380015d5122ef389b7a1a79603a89a9b96fcd741.patch"
        }
      ]
    },
    {
      "id": "compatibility-finding-2",
      "severity": "medium",
      "summary": "Task-only closure and verification artifacts do not alter runtime behavior or invalidate the focused E2E evidence.",
      "broken_invariant": "Compatibility evaluator facade requires independent review evidence.",
      "evidence_refs": [
        {
          "path": ".agentplane/tasks/202608061646-WCARQG/quality/objects/sha256/87f84112d774433f055ea519380015d5122ef389b7a1a79603a89a9b96fcd741.patch"
        }
      ]
    }
  ],
  "missing_tests": [],
  "hidden_assumptions": []
}
