{
  "schema_version": 1,
  "kind": "evaluator_result",
  "evaluator_id": "recovery-context",
  "verdict": "pass",
  "findings": [
    {
      "id": "compatibility-finding-1",
      "severity": "medium",
      "summary": "Reviewed commit c48ce0be: the new response module preserves digest sealing, full serialized response-budget validation, and the typed reservation-unavailable outcome; arch:check, typecheck, and focused request/lifecycle/lock tests passed.",
      "broken_invariant": "Compatibility evaluator facade requires independent review evidence.",
      "evidence_refs": [
        {
          "path": ".agentplane/tasks/202607221852-01ACZ9/quality/20260730-152419596-recovery-context/evaluator-diff.patch"
        }
      ]
    }
  ],
  "missing_tests": [],
  "hidden_assumptions": []
}
