{
  "schema_version": 1,
  "kind": "evaluator_result",
  "evaluator_id": "recovery-context",
  "verdict": "pass",
  "findings": [
    {
      "id": "compatibility-finding-1",
      "severity": "medium",
      "summary": "No blocking finding: task-run execution contracts are isolated in a dedicated type module; Hermes checks concrete typed values rather than assigning matcher any values.",
      "broken_invariant": "Compatibility evaluator facade requires independent review evidence.",
      "evidence_refs": [
        {
          "path": ".agentplane/tasks/202607221850-R7WS01/quality/20260728-025517959-recovery-context/evaluator-diff.patch"
        }
      ]
    }
  ],
  "missing_tests": [],
  "hidden_assumptions": []
}
