{
  "schema_version": 1,
  "kind": "evaluator_result",
  "evaluator_id": "recovery-context",
  "verdict": "pass",
  "findings": [
    {
      "id": "external-agent-finding-1",
      "severity": "medium",
      "summary": "Reviewed the frozen actual diff 93676f0b9d9b8e1bb7fd2774a97efcb32d8751c4928675d72c00042ee09d4ca7.patch against the approved single repair WorkItem, current non-material amendment and Verify Steps. The additional production changes stay in the existing conflict, policy observation and supervisor owners. No release metadata, dependency, MPXQBK, stale branch import or provider-neutral expansion was added.",
      "broken_invariant": "External EVALUATOR review requires evidence-backed semantic judgement.",
      "evidence_refs": [
        {
          "path": ".agentplane/tasks/202609041801-ZVX69C/quality/objects/sha256/93676f0b9d9b8e1bb7fd2774a97efcb32d8751c4928675d72c00042ee09d4ca7.patch"
        }
      ]
    },
    {
      "id": "external-agent-finding-2",
      "severity": "medium",
      "summary": "Conflict semantic input now rejects disagreement between local.base_head_sha and base_context.current_base_sha and between provider.base_sha and provider_conflict_base_sha. External and managed snapshot, merge-parent, execution evidence and verification-checkpoint paths use the current local base consistently. Live provider identity still compares the original provider base, so the repair does not silently accept provider drift.",
      "broken_invariant": "External EVALUATOR review requires evidence-backed semantic judgement.",
      "evidence_refs": [
        {
          "path": ".agentplane/tasks/202609041801-ZVX69C/quality/objects/sha256/93676f0b9d9b8e1bb7fd2774a97efcb32d8751c4928675d72c00042ee09d4ca7.patch"
        }
      ]
    },
    {
      "id": "external-agent-finding-3",
      "severity": "medium",
      "summary": "Reviewed conflict-rework-authority.ts and both managed application/recovery callers. Policy equivalence is limited to a reobservation of the accepted scope using actual current policy/configuration bytes; policy module selection must remain equal. The Git owner independently proves the exact accepted merge tree and all other authority components remain compared. The normalized progress comparison permits an unchanged Task after the merge cutpoint to reuse the original execution; changed Task state still requires the exact native afterimage proof.",
      "broken_invariant": "External EVALUATOR review requires evidence-backed semantic judgement.",
      "evidence_refs": [
        {
          "path": ".agentplane/tasks/202609041801-ZVX69C/quality/objects/sha256/93676f0b9d9b8e1bb7fd2774a97efcb32d8751c4928675d72c00042ee09d4ca7.patch"
        }
      ]
    },
    {
      "id": "external-agent-finding-4",
      "severity": "medium",
      "summary": "The regression matrix preserves existing success, interruption and tamper cases and adds seven advanced-base cases. Tests assert retention of base-only content, no repeated provider execution after merge or Task-write interruption, and repeated rejection of changed policy, local base and provider base without altering HEAD. The independent wrong-base merge guard and malformed-context unit cases cover negative identities. Mechanical relocation of the existing fake provider introduces no competing implementation.",
      "broken_invariant": "External EVALUATOR review requires evidence-backed semantic judgement.",
      "evidence_refs": [
        {
          "path": ".agentplane/tasks/202609041801-ZVX69C/quality/objects/sha256/93676f0b9d9b8e1bb7fd2774a97efcb32d8751c4928675d72c00042ee09d4ca7.patch"
        }
      ]
    },
    {
      "id": "external-agent-finding-5",
      "severity": "medium",
      "summary": "All nine frozen evaluator evidence digests match their declared hashes. The current verification record 20260905235054264-fef636be01d8e0fa.json records result ok for implementation 1050a0f4856603b998283a05f2caa4cc8ebcca96 with bound implementation/context/environment/contract/Verify Steps inputs. All 11 declared checks passed, including required CLI 72 tests, core 147 tests, evaluator/runner 21 tests, formatting, lint, types, routing, task lint, doctor, diff check and full CI. The separate conflict matrix reports 37 passing scenarios and the four unit suites 85 passes; their scope is not represented as final-main evidence.",
      "broken_invariant": "External EVALUATOR review requires evidence-backed semantic judgement.",
      "evidence_refs": [
        {
          "path": ".agentplane/tasks/202609041801-ZVX69C/quality/objects/sha256/93676f0b9d9b8e1bb7fd2774a97efcb32d8751c4928675d72c00042ee09d4ca7.patch"
        }
      ]
    },
    {
      "id": "external-agent-finding-6",
      "severity": "medium",
      "summary": "The prior owner-controlled recovery contracts remain intact: original run/result/journal provenance, immutable Git snapshot and parent/tree checks, exact prepared native Task afterimages, verification checkpoint replay and rejection of foreign artifacts. The retained task commit chain supplies rollback evidence. The scoped salvage classification remains unchanged: PX8PZT carries the necessary minimal lifecycle ports; obsolete branches are not imported, and release/MPXQBK/GitLab expansion remain excluded.",
      "broken_invariant": "External EVALUATOR review requires evidence-backed semantic judgement.",
      "evidence_refs": [
        {
          "path": ".agentplane/tasks/202609041801-ZVX69C/quality/objects/sha256/93676f0b9d9b8e1bb7fd2774a97efcb32d8751c4928675d72c00042ee09d4ca7.patch"
        }
      ]
    },
    {
      "id": "external-agent-finding-7",
      "severity": "medium",
      "summary": "Residual risk: The branch is not yet integrated. This verdict does not approve queue mutation from stale identity or transfer these checks to a future merge tree. Fresh conflict resolution and SHA-bound verification are still required.",
      "broken_invariant": "External EVALUATOR review requires evidence-backed semantic judgement.",
      "evidence_refs": [
        {
          "path": ".agentplane/tasks/202609041801-ZVX69C/quality/objects/sha256/93676f0b9d9b8e1bb7fd2774a97efcb32d8751c4928675d72c00042ee09d4ca7.patch"
        }
      ]
    },
    {
      "id": "external-agent-finding-8",
      "severity": "medium",
      "summary": "Residual risk: PH5N6S disposition, hosted terminal state, queue/cleanup and full final-main verification remain part of the overall Clean Core goal.",
      "broken_invariant": "External EVALUATOR review requires evidence-backed semantic judgement.",
      "evidence_refs": [
        {
          "path": ".agentplane/tasks/202609041801-ZVX69C/quality/objects/sha256/93676f0b9d9b8e1bb7fd2774a97efcb32d8751c4928675d72c00042ee09d4ca7.patch"
        }
      ]
    }
  ],
  "missing_tests": [],
  "hidden_assumptions": [
    "Supervisor-owned exchange, journal and run artifacts retain their declared provenance boundary. Hash comparison does not provide OS sandbox isolation."
  ]
}
