{
  "schema_version": 1,
  "kind": "evaluator_result",
  "evaluator_id": "recovery-context",
  "verdict": "pass",
  "findings": [
    {
      "id": "compatibility-finding-1",
      "severity": "medium",
      "summary": "The canonical runtime ignore set now includes .agentplane/tmp, so every caller receives the same policy.",
      "broken_invariant": "Compatibility evaluator facade requires independent review evidence.",
      "evidence_refs": [
        {
          "path": ".agentplane/tasks/202608031303-B5Q5NM/quality/20260803-131213423-recovery-context/evaluator-diff.patch"
        }
      ]
    },
    {
      "id": "compatibility-finding-2",
      "severity": "medium",
      "summary": "Upgrade now repairs the complete canonical runtime ignore contract rather than the SQLite-only subset; the regression test proves idempotence and user-rule preservation.",
      "broken_invariant": "Compatibility evaluator facade requires independent review evidence.",
      "evidence_refs": [
        {
          "path": ".agentplane/tasks/202608031303-B5Q5NM/quality/20260803-131213423-recovery-context/evaluator-diff.patch"
        }
      ]
    }
  ],
  "missing_tests": [],
  "hidden_assumptions": []
}
