{
  "schema_version": 1,
  "kind": "evaluator_result",
  "evaluator_id": "recovery-context",
  "verdict": "pass",
  "findings": [
    {
      "id": "external-agent-finding-1",
      "severity": "medium",
      "summary": "No correctness, scope, or regression finding requires rework for implementation commit b07419e2f5cf369848dad0876a88fb2cf6e1c6b5.",
      "broken_invariant": "External EVALUATOR review requires evidence-backed semantic judgement.",
      "evidence_refs": [
        {
          "path": ".agentplane/tasks/202608101410-4GSCYN/quality/objects/sha256/ff3d88c96ad19b6815ebffc37c977dedc943fee9290b3b14710451bd93ec4887.patch"
        }
      ]
    },
    {
      "id": "external-agent-finding-2",
      "severity": "medium",
      "summary": "Residual risk: The separate accepted-before-freshness/worktree-resolution lifecycle defect observed during recovery is outside this task and requires its own regression and fix.",
      "broken_invariant": "External EVALUATOR review requires evidence-backed semantic judgement.",
      "evidence_refs": [
        {
          "path": ".agentplane/tasks/202608101410-4GSCYN/quality/objects/sha256/ff3d88c96ad19b6815ebffc37c977dedc943fee9290b3b14710451bd93ec4887.patch"
        }
      ]
    }
  ],
  "missing_tests": [],
  "hidden_assumptions": []
}
